<?xml version="1.0" encoding="UTF-8"?>
<package packagerversion="1.9.1" version="2.0" xmlns="http://pear.php.net/dtd/package-2.0" xmlns:tasks="http://pear.php.net/dtd/tasks-1.0" xmlns:xsi="http://www.w3.org/2001/XMLSchema-instance" xsi:schemaLocation="http://pear.php.net/dtd/tasks-1.0                              http://pear.php.net/dtd/tasks-1.0.xsd                              http://pear.php.net/dtd/package-2.0                              http://pear.php.net/dtd/package-2.0.xsd">
 <name>pearweb_pepr</name>
 <channel>pear.php.net</channel>
 <summary>The source code for the PEAR website package voting</summary>
 <description>The pearweb_pepr package contains backend and frontend code
 for the package voting part of pearweb as well as the layout for it</description>
 <lead>
  <name>Martin Jansen</name>
  <user>mj</user>
  <email>mj@php.net</email>
  <active>yes</active>
 </lead>
 <lead>
  <name>Greg Beaver</name>
  <user>cellog</user>
  <email>cellog@php.net</email>
  <active>yes</active>
 </lead>
 <lead>
  <name>David Coallier</name>
  <user>davidc</user>
  <email>davidc@php.net</email>
  <active>yes</active>
 </lead>
 <lead>
  <name>Pierre-Alain Joye</name>
  <user>pajoye</user>
  <email>pajoye@php.net</email>
  <active>no</active>
 </lead>
 <lead>
  <name>Helgi Thormar</name>
  <user>dufuz</user>
  <email>dufuz@php.net</email>
  <active>yes</active>
 </lead>
 <developer>
  <name>Stig Bakken</name>
  <user>ssb</user>
  <email>stig@php.net</email>
  <active>no</active>
 </developer>
 <developer>
  <name>Tomas V.V.Cox</name>
  <user>cox</user>
  <email>cox@idecnet.com</email>
  <active>no</active>
 </developer>
 <developer>
  <name>Daniel Convissor</name>
  <user>danielc</user>
  <email>danielc@php.net</email>
  <active>no</active>
 </developer>
 <developer>
  <name>Tobias Schlitt</name>
  <user>toby</user>
  <email>toby@php.net</email>
  <active>no</active>
 </developer>
 <developer>
  <name>Christian Weiske</name>
  <user>cweiske</user>
  <email>cweiske@php.net</email>
  <active>yes</active>
 </developer>
 <developer>
  <name>Mark Wiesemann</name>
  <user>wiesemann</user>
  <email>wiesemann@php.net</email>
  <active>yes</active>
 </developer>
 <date>2011-04-13</date>
 <time>20:36:56</time>
 <version>
  <release>1.0.4</release>
  <api>0.1.0</api>
 </version>
 <stability>
  <release>stable</release>
  <api>stable</api>
 </stability>
 <license uri="http://www.php.net/license">PHP License</license>
 <notes>
- Migration to QF2 for everything but pepr-proposal-editing [clockwerx]
- Remove BBCode (in favour of only supporting Text_Wiki from now on) [till]
- Small refactoring while debugging [till]
- Fix Bug #16578 Unable to use https URL in &quot;Links&quot; section [saltybeagle]
 </notes>
 <contents>
  <dir baseinstalldir="/pear.php.net/" name="/">
   <dir name="cron">
    <file name="pepr.php" role="www" />
   </dir> <!-- /cron -->
   <dir name="include">
    <dir name="pepr">
     <file name="pepr-emails.php" role="www" />
     <file name="pepr-ppcomment.php" role="www" />
     <file name="pepr-pplink.php" role="www" />
     <file name="pepr-ppvote.php" role="www" />
     <file name="pepr-proposal.php" role="www" />
     <file name="pepr.php" role="www" />
    </dir> <!-- /include/pepr -->
   </dir> <!-- /include -->
   <dir name="public_html">
    <dir name="pepr">
     <file name="index.php" role="www" />
     <file name="pepr-bbcode-help.php" role="www" />
     <file name="pepr-comments-show.php" role="www" />
     <file name="pepr-proposal-delete.php" role="www" />
     <file name="pepr-proposal-edit.php" role="www" />
     <file name="pepr-proposal-show.php" role="www" />
     <file name="pepr-qa-stats.php" role="www" />
     <file name="pepr-vote-show.php" role="www" />
     <file name="pepr-votes-show.php" role="www" />
    </dir> <!-- /public_html/pepr -->
   </dir> <!-- /public_html -->
   <dir name="sql">
    <file name="pearweb_pepr.xml" role="www" />
   </dir> <!-- /sql -->
  </dir> <!-- / -->
 </contents>
 <dependencies>
  <required>
   <php>
    <min>5.2.3</min>
   </php>
   <pearinstaller>
    <min>1.7.1</min>
   </pearinstaller>
   <package>
    <name>PEAR</name>
    <channel>pear.php.net</channel>
    <min>1.7.1</min>
   </package>
   <package>
    <name>HTML_QuickForm</name>
    <channel>pear.php.net</channel>
    <min>3.2.12</min>
   </package>
   <package>
    <name>HTML_QuickForm2</name>
    <channel>pear.php.net</channel>
    <min>0.5.3</min>
   </package>
   <package>
    <name>pearweb</name>
    <channel>pear.php.net</channel>
    <min>1.18.0</min>
   </package>
   <package>
    <name>Text_Wiki</name>
    <channel>pear.php.net</channel>
    <min>1.2.0</min>
   </package>
   <extension>
    <name>pcre</name>
   </extension>
   <extension>
    <name>mysqli</name>
   </extension>
  </required>
 </dependencies>
 <phprelease />
 <changelog>
  <release>
   <version>
    <release>1.0.0</release>
    <api>0.1.0</api>
   </version>
   <stability>
    <release>stable</release>
    <api>stable</api>
   </stability>
   <date>2009-04-28</date>
   <license uri="http://www.php.net/license">PHP License</license>
   <notes>
- split the pepr code from pearweb [dufuz]
   </notes>
  </release>
  <release>
   <version>
    <release>1.0.1</release>
    <api>0.1.0</api>
   </version>
   <stability>
    <release>stable</release>
    <api>stable</api>
   </stability>
   <date>2009-04-29</date>
   <license uri="http://www.php.net/license">PHP License</license>
   <notes>
- Remove include/Damblan/Search/PEPr.php since it should be in the main package
   </notes>
  </release>
  <release>
   <version>
    <release>1.0.2</release>
    <api>0.1.0</api>
   </version>
   <stability>
    <release>stable</release>
    <api>stable</api>
   </stability>
   <date>2009-06-20</date>
   <license uri="http://www.php.net/license">PHP License</license>
   <notes>
Refactored RSS feeds for bugs
Changed RSS feeds for homepage
Individual bugs now render Baetle (RDF)
Improved homepage to focus on the human side(s) of PEAR
   </notes>
  </release>
  <release>
   <version>
    <release>1.0.3</release>
    <api>0.1.0</api>
   </version>
   <stability>
    <release>stable</release>
    <api>stable</api>
   </stability>
   <date>2009-09-07</date>
   <license uri="http://www.php.net/license">PHP License</license>
   <notes>
- Remove date_format which caused pepr proposals to be stuck forever [bbieber]
- Fix HTML errors [cweiske]
- Fix bug #16410: Rejected PEPr proposals should not steal names [clockwerx]
- Dropped restrictions around &quot;the same user must be the re-proposer&quot; [clockwerx]
   </notes>
  </release>
  <release>
   <version>
    <release>1.0.4</release>
    <api>0.1.0</api>
   </version>
   <stability>
    <release>stable</release>
    <api>stable</api>
   </stability>
   <date>2011-04-13</date>
   <license uri="http://www.php.net/license">PHP License</license>
   <notes>
- Migration to QF2 for everything but pepr-proposal-editing [clockwerx]
- Remove BBCode (in favour of only supporting Text_Wiki from now on) [till]
- Small refactoring while debugging [till]
- Fix Bug #16578 Unable to use https URL in &quot;Links&quot; section [saltybeagle]
   </notes>
  </release>
 </changelog>
</package>
