<?xml version="1.0" encoding="UTF-8"?>
<package packagerversion="1.8.0alpha1" version="2.0" xmlns="http://pear.php.net/dtd/package-2.0" xmlns:tasks="http://pear.php.net/dtd/tasks-1.0" xmlns:xsi="http://www.w3.org/2001/XMLSchema-instance" xsi:schemaLocation="http://pear.php.net/dtd/tasks-1.0                              http://pear.php.net/dtd/tasks-1.0.xsd                              http://pear.php.net/dtd/package-2.0                              http://pear.php.net/dtd/package-2.0.xsd">
 <name>pearweb_election</name>
 <channel>pear.php.net</channel>
 <summary>The source code for the PEAR website election</summary>
 <description>The pearweb_election package contains backend and frontend code
 for the election part of pearweb as well as the layout for it</description>
 <lead>
  <name>Martin Jansen</name>
  <user>mj</user>
  <email>mj@php.net</email>
  <active>yes</active>
 </lead>
 <lead>
  <name>Greg Beaver</name>
  <user>cellog</user>
  <email>cellog@php.net</email>
  <active>yes</active>
 </lead>
 <lead>
  <name>David Coallier</name>
  <user>davidc</user>
  <email>davidc@php.net</email>
  <active>yes</active>
 </lead>
 <lead>
  <name>Pierre-Alain Joye</name>
  <user>pajoye</user>
  <email>pajoye@php.net</email>
  <active>no</active>
 </lead>
 <lead>
  <name>Helgi Thormar</name>
  <user>dufuz</user>
  <email>dufuz@php.net</email>
  <active>yes</active>
 </lead>
 <developer>
  <name>Stig Bakken</name>
  <user>ssb</user>
  <email>stig@php.net</email>
  <active>no</active>
 </developer>
 <developer>
  <name>Tomas V.V.Cox</name>
  <user>cox</user>
  <email>cox@idecnet.com</email>
  <active>no</active>
 </developer>
 <developer>
  <name>Daniel Convissor</name>
  <user>danielc</user>
  <email>danielc@php.net</email>
  <active>no</active>
 </developer>
 <developer>
  <name>Tobias Schlitt</name>
  <user>toby</user>
  <email>toby@php.net</email>
  <active>no</active>
 </developer>
 <developer>
  <name>Christian Weiske</name>
  <user>cweiske</user>
  <email>cweiske@php.net</email>
  <active>yes</active>
 </developer>
 <developer>
  <name>Mark Wiesemann</name>
  <user>wiesemann</user>
  <email>wiesemann@php.net</email>
  <active>yes</active>
 </developer>
 <date>2009-01-02</date>
 <time>04:33:37</time>
 <version>
  <release>1.0.0</release>
  <api>0.1.0</api>
 </version>
 <stability>
  <release>stable</release>
  <api>stable</api>
 </stability>
 <license uri="http://www.php.net/license">PHP License</license>
 <notes>
- split the election code from pearweb [dufuz]
 </notes>
 <contents>
  <dir baseinstalldir="/" name="/">
   <dir name="cron">
    <file name="election_results.php" role="www" />
   </dir> <!-- /cron -->
   <dir name="include">
    <dir name="election">
     <file name="pear-election-accountrequest.php" role="www" />
     <file name="pear-election.php" role="www" />
     <file name="pear-voter.php" role="www" />
    </dir> <!-- /include/election -->
   </dir> <!-- /include -->
   <dir name="public_html">
    <dir name="election">
     <file name="edit.php" role="www" />
     <file name="index.php" role="www" />
     <file name="info.php" role="www" />
     <file name="new.php" role="www" />
    </dir> <!-- /public_html/election -->
   </dir> <!-- /public_html -->
   <dir name="sql">
    <file name="pearweb_election.xml" role="www" />
   </dir> <!-- /sql -->
   <dir name="templates">
    <dir name="election">
     <file name="confirm.tpl.php" role="www" />
     <file name="confirmed.tpl.php" role="www" />
     <file name="dovote.tpl.php" role="www" />
     <file name="listforedit.tpl.php" role="www" />
     <file name="new-step1.tpl.php" role="www" />
     <file name="new-step2.tpl.php" role="www" />
     <file name="new-step3.tpl.php" role="www" />
     <file name="pending.tpl.php" role="www" />
     <file name="register.tpl.php" role="www" />
     <file name="results.tpl.php" role="www" />
     <file name="showresults.tpl.php" role="www" />
     <file name="vote.tpl.php" role="www" />
    </dir> <!-- /templates/election -->
   </dir> <!-- /templates -->
  </dir> <!-- / -->
 </contents>
 <dependencies>
  <required>
   <php>
    <min>5.2.3</min>
   </php>
   <pearinstaller>
    <min>1.7.1</min>
   </pearinstaller>
   <package>
    <name>PEAR</name>
    <channel>pear.php.net</channel>
    <min>1.7.1</min>
   </package>
   <package>
    <name>pearweb</name>
    <channel>pear.php.net</channel>
    <min>1.18.0</min>
   </package>
   <package>
    <name>Text_Wiki</name>
    <channel>pear.php.net</channel>
    <min>1.2.0</min>
   </package>
   <extension>
    <name>pcre</name>
   </extension>
   <extension>
    <name>mysqli</name>
   </extension>
  </required>
 </dependencies>
 <phprelease />
 <changelog>
  <release>
   <version>
    <release>1.0.0</release>
    <api>0.1.0</api>
   </version>
   <stability>
    <release>stable</release>
    <api>stable</api>
   </stability>
   <date>2009-01-02</date>
   <license uri="http://www.php.net/license">PHP License</license>
   <notes>
- split the election code from pearweb [dufuz]
   </notes>
  </release>
 </changelog>
</package>
